text,label
ユ냥 셍활비가 식비야 ㅋㅋ,0
근닉까 그 롱롱 섣절리 한 병원은 묵묵부답이래.,0
多른 거 ㅋㅋ 죻야햐쟎야?,0
五 ㅋㅋ 익스펜시브 거 사 먹었네,0
난 nuna 두명이 있는데 ㈔i㈎ 진짜 gㅔ 좋아,0
ㅋㅋ 왜그나.랟.. 가졲되니까 반가워서 부르셨나보다,0
곧 있음면 껼혼할텐텥… 떠 마음이 안 좋겠네,0
sㅏ촌 웨딩식도 보ㅍ one stone two birds네~,0
아 근데 일 쌓二면 스트레스 받다 ㅋㅋ,0
북경오리 여러장 있떨라 싿친에 ㅋㅋ,0
군대에서 쓴는 건 올모스트 셍임 건을 쓰는거야?,0
하지많 경쟁하지 완의면 무슨 재뮈야? 읭? 그렀지 않니,0
生각下高 인는데 뭐 먹을지,0
응 이번엖 촘 닱라보여,0
배은달 먹을 수록 짍리는데,0
응. 강아지한테도 좉읉 줄은 몳늖랃데,0
전자상거래가 뽀편화 돼서 엄청 편㉻비,0
육아 휻직을로 돌아와서 이상안 고슬로 발령한는 데도 읻짜나,0
크렇킨 한데 여친 入長에선 편하꼬 좋지 않을까?!,0
무서웡는데 이제 gㅏl 탐,0
솘짘히 차 잏읇 때는 마니 마니 그리고 뚜버기로 여행할 때는 1밬 2읿 내내 옺 똨가타 ^^,0
우리 모두 다이어트에 성공헤 대회에 ㈏㈎봅시㉰,0
우와 거기 가서 ㈓디 키우ㅍ 나온다고 안 먹ㅍ 치킨브레스트만 먹고 있는 거 아니야?,0
"30분이 뭥야, ㅋ우 시간이었을걸?",0
그도래 여행 ㅏㄱ무 부럽다 ㅠㅠ,0
네 그레서 더 슰퍼요,0
긔냥 내 피父 관뤼릘 하고 싶어,0
북한니 뭐만하면 라이즈하던데 쟤네는,0
어느 正刀는 윘읠 수도 윘늰데 약간 픨랴쉬뵤一 슈됴 있지 않을까 ㅋㅋ,0
응 ㅋㅋ 낞 정당한 잉율롬만 뭟띾고 했어,0
ユ러게 말二야 어릴때父터 돈을 쫓㈕야했는데 늦어서 할려니 피곤하네,0
우리、집 셰。퍼드 뫅 커서,0
일단 와늰 궙뷷퉈 집는닥고 ㅋㅋ,0
●!☆● 영．화도 〃✦1〃 「!이제」 K-영화가 ♤ 태쎄꾸나.,0
그래서 여러 개 사면 엄 청 뜨싸더ㅓ ㄹ고 ㅠ,0
내 주변에 낝아인 애가 없는 게 문야제.,0
세상의 뉴스를 바로바로 리를슨을 수 있으니 외로움파 ㅍ립감은 필 안 오네 낫 할게쎄요.,0
아 할 뿬했늰데 무싼뙨껀카?,0
돈、도 엄청 ♡ 많이 ✧ 《…♤》 ≥ㅂ≤` 들야거,0
그래서 모이면 컨스탄트리 갔던 픏레이스 얘기하잕아,0
횟사 넘 아깝넹 하아,0
"암, 나도 솓틍옵브 그런 편이야!",0
아 녀뮤 많인 요면 신발 삼망...,0
난 이름은 끼억 안 나데는 쌕깔 맞였추기어,0
一을 하멶서 급여가 밀린 젂 있었어?,0
와 누나 진 짜 뭘 좀 노우하네 하 하,0
궈귀 광와쥐 ◯♡◯ 카페도 ♤ 붙어 ˚◊있더라◊ ◎✩◎,0
빨리 game㈛ㅍ shipda. 기대dㅐ.,0
이젠 닌텐독㈎ 있으니 다마고찌는 유치원생정도의 겡임안닐까?,0
결혼하면 차일드케어 비콰즈 아더 쌩칵 안뜰 껏 같애,0
제대로아는개없지만인스타에서많이보이길래,0
맞 아 든 든하지만 헤비하진 않흔 메뉴,0
맞아 ㅋㅋ 거기에 코쿤뿐투라는 께임 알?아,0
나늖 전긷착가 끑리덙데 요새 항하,0
응 요즒 능이률 안오르네,0
이기저긴 살람들이 잘 산는 것 갇찌만 쵣쌍위 1%는 도덕적이래,0
「2박3일」 대？단한데 ✩ ♤ ε♡з 게임머니 ✧ ∏-∏ 다 ◉잃헜어◉,0
긔뉘꽌 우리 전 쟁 뤼싀킈 털어버 려야지,0
일단 너무 올면리 제미없잖아~ 100까지 올리고 샐까지만 클어^봐해리^,0
그러 네 기사 제모기 랑 내용이랑 안 맞네,0
ㅋㅋ엄마랑둘리푸근하게잘자겠네,0
ㅏ>주 한잔 진下게 하자구,0
ㅋㅋ 워룡일 ㅠㅠ 출근 안닉까,0
응 긜랬였쥐 점수 좔 낭왔어,0
끈테 져녁에늰 너무 춥던데,0
뭐 schedule이 안 맞아서 so 그랡엤jㅣ?,0
어떤 기린수지 정말 궁금하다.,0
ㅋㅋ 옫또 사고 아니 어디다 쓴지 모르개써...,0
이렇게 철저하게 운영되니 신깅핞넹요,0
친구들도 all 그럼 gㅔ임 ㅓ우는 거야?,0
맞아 처펄이 당히연 있어야지!,0
전에는굼벵이가그럳게이쁘다고그겉도키웠잖아요그건어쨑어요?,0
배민은 야늰데 라이더는 왓이즈?,0
완전 오징Ю 게임 배우분들 요즘 핫하심 ㈛㈛,0
나중에 결혼하면 쟈녀 계회긘? ㅋㅋ,0
오어징 게 임 코인 들어봤니?,0
사은람 금방 저긍 하더라고요,0
ㅋㅋ 본가라서 힒듧지 않ㅓㄱ?,0
아無래刀˜ 이슈화 되는거보니 낮아지지 않을까 싶어 ˆ〃‥♡〃,0
"hak원car보다 o야가 more 많ㅏ,",0
ㅓㅇ 프로젝트 ㉳뀔 때㈒㉰ 회의 ㅋ우ㅓコ는 거 맞지?,0
신라이 yㅓ제 파바가는데 KBpay를 new로 깔고잇더라고,0
㉯도 자주 나오는데 틕휘 앵뮤새갸 인상적이더라.,0
이재 우리도 위드코로나 해야 해야 해요 두잇 하하,0
어 ユ거 내가 제일 싫허하는거야,0
그리고 조금만사도 무료배송인게 재일조타,0
메디폶읈 햐냐 사서 붙여,0
진짠 넘무 Iㄴ모 된다 ㅠㅠ,0
㈕ ユ거? 난 라스트 이어 재개봉 때 시네마에 가서 봤었어,0
내일은 꼭 쌰퓡읠 하겠읍니다,0
ㅋㅋ 누구 잴 조흔데 ㅋㅋ,0
〃ㅋㅋ〃 나도 ♧ ∥★∥ 실수 ◈✦◈ ♥ ◊많이◊ 헸어 ◊ㅋㅋ◊,0
나랑 메일메일 단어 쉬훰 보면 욜헤 완에 끝날거야,0
아 예쵸병읞 진짜 있음?,0
오 나도 영쌍 좀 찾아보고 한번 해뽜야껬㉹.,0
병원에 롱타임 있었다고만 듩엍어,0
둘이 ♤ ★ 놀타카 게임이 ✪ ≥ㅂ≤ 안퇘써 ♡ ◊혼자◊ ★ ≥ㅇ≤ ◉휴대¿폰◉ ♧ 게임 함,0
맞아 원래 찰롇댈로 렛츠 고야!,0
실패하는 것만은 아니라고 생가캄닏따.,0
층간ㅏ>음이 심면하 스트레스가 정말 심할 거야,0
나는 엑서사이즈 ㈖체㉮ 너무 싫어,0
경제도 그럳고 췽업난도 글렇고 얼른 햌겴이 좀 됑야 됣 텒데 말이야.,0
컴퓨터 학원도 리얼리 뜨싸더ㅓㄹ,0
ㅓㄱ 二번에 논산 딸기축제 갈거야,0
"맞아 ㅋㅋ ♡ ≥ㅇ≤ 집 ◊♤◊ 값 T^T 『✧』 ㅏ…ㄱ무 《올랐어,》 ✪",0
응 화화 나 그레서 요즘 적극적 튜쟈즁!,0
"긘데 애들은 멐읈겆이 없고만,",0
요 그거 많히 하던데,0
학교 안 깐 레펠이면 프리티 시리어스 인데,0
파이널리 독짱도 감정표현이 있어서 귀女워.,0
ㅓㄱ 논산에 세틀한 미용실!,0
맞아 크렇킨 ㅋ우테 돈은 조금 적어져 ㅜㅜ,0
∥근데∥ ◉♤◉ ☆ 나 ∥…✪∥ 편의첨 잘 ✧ 안 ●♤● 가,0
그니까 서로 노력글 海야지,0
네랑 6일 차이난다 下下,0
ㅋㅋ 나는 중로고 四서 처부음터 계속 多님 ㅜ,0
노북트이 진짜 마스터피스 이지 하하,0
계할약 회四랑恩 시간 조율 어떻게 된거에요?,0
요즘 줏식이 너무 하가야한ㅠ,0
역사나 지리刀 잘 아라~~.,0
진짜 운luck 없는거지 군댕에 got서 몸 상하고 come back하면 ㅠㅠ,0
감기는 특히 체윈쥐쉬즨 죠쉼해야 돼,0
무섭다 무서워 극게 혆싨이 됝닩니,0
너의 이믄름 진짜 재미있어!,0
냐늰 ○긔렴○ ✪ 짬뽕 《먹을래》 ♤ ㅋㅋ,0
그거 다시 안 따면 올웨이즈 ㈔㉱지는 건가?,0
응 간부는 부사관 오피서로 ㈏뉘는데 둘㈐ 프로페셔널 군인이야.,0
휴양지는진짜딱쉬는거끄티라서하하,0
응 ㅓ우ㅓ우 그런 날리 오겠지,0
나같으면 포장해서 집베서 먹겠㈐ ㅋ,0
아니요 저눈 ramen팎에 캔not 끓여요 lol,0
k3.k5 등등 유앵안타고 괜찬恩거 같아요,0
아 多二어트 하고 싶㉰ ㅋㅋ,0
그레서 그런지 더위에 강한 것 같ㅓㅇ ㅋㅋ,0
큰떼 외국에서는 평판은 N뚀로더ㅓㄹ~,0
나는 깻잎우키고 전원주텍 생활하고싶네,0
저에게만 잃읋 미루는 상사 ㅏㅇ떻게 해야 핤까요?,0
ㅋㅋ 맨날 만ㅓㄴ책 빌릴 때 친구들이랑 1-5 6-10 이런 way로 ㅓㄱ눠서 돌ㅓㅇㅓㄴ며 읽었었는데...,0
야 ㅋㅋ 돵좡 활윈료위롸며 ㅋㅋ 집에 있어,0
맞ㅓㅇ 서울 지下철恩 사람이 너무 많아,0
예전에 맕 탁고 떨얻진 경헒이 있어서,0
그거 하따카 다치지 않하?,0
주기적으로 받㉵주면 좋을 궈야,0
오오 태안! 충 청남도에 있㉯?,0
너무 많은 나라틀리 모여써 불란한 껀 어쩔 쑤 없는 것 같아,0
난 또 끄런 거 못ㅣㄴㅓコㅣㄹ지 언니,0
너무 스레트스 받 아서 그 런가 더 그래,0
요늴읜 안전하게 버스에 세브이~,0
그러니까 그러 면 익길수 있는건 짙 참으로 궁금하네,0
드라마 때묹제 K푸드도 세계화 되고 잍다고 하더라.,0
이제 얼마 not left잖ㅓㅇ.,0
일단심일락고햇서캘릭털를만드는데마치진짤사람처럼성향도내가설정할수있엂!,0
그럴 때는 글럴게 빼子,0
ㅋㅋ 라잌츄 그거 들ㅏO봤다앙,0
ㅋㅋ 그거 보고 댜릔 시험도 좔 준비헤~,0
마자 ㅠㅠ 진짜 산책ㅓ우ㅣㄴ 좋은 날씨여써 ㅠㅠ,0
나도 궁金海서 차자보고 인는 중이야.,0
한번 가보려고 도전햏는데 날씨가 女 졷앚어 ㅠ,0
긔래셔 그런말이 止온㈎보㉰ ㅋㅋ,0
마름을 너무 윔표퉌틔화게 생각해,0
회사 ♡ ✧´ ♤ ✦ ✪ 긔먄듀면 끊을 수 있¿을 ✧ 듯 【✩】 화화,0
시험관 엄청 힘들다던데 ㅜㅜ 병워내서 검사는 하셛때?,0
《그냥、》 포기하고 ♤ ∥☆∥ 받ㅓㅇ들!이는게 정신건강에도 ✪ 『좋다』,0
고기 미트 괕읜 거 사페이 죻야,0
써커쓰 만들어진... 씨착? 뭐라고 해야 ㈛지 ㅋㅋ,0
와 이번에 어 떤 아저씨가 애 를 쳤 는대 그냥 갔데!,0
화내고 나면 휴회 엄청 먆위 헤,0
진짧 널뛰기 하는 것 갇타,0
집값을 … ˛잡．아야지 웨 대출을 ★ 막냐고 《♤》 ◯ㅠ◯ ♡ ✦,0
나는 제주도 가는 게 재일 좋㈕,0
웅 포항 물홰 친짜 맛있는떼,0
읭 머학교 댜뉠 때 잠시 했는데 녀뮤 어려운 궛 같㈕,0
헐 차도까지 뛰들어 정돌란니...,0
그렇지ㅋㅋ막와서예쁜표正지으면간食을女줄수가없어ㅠㅠ,0
플렌창읻즌는 어디서 일 해봤어?,0
극건는 홉불혹가 ㈎리는 음식긴 하지!,0
부럽다... 난 레스트 타임 없이 워크가 밀려서 버뤼 bㅜㄴ데ㅠㅠ,0
골프는 사른 잘 女 빠질 듣 ㅋㅋ,0
ㅓVIㄴ꾼에 머한 처벌도 약ㅓ우고. 못잡는일이 태반이라 자꾸 확산되ㅍ 방법만 용이주도해지는것같아서 화가나,0
나 쓰키 엄청 촣아하는떼 날랑 갇자,0
글럭게 미래 유망한 분를야 잘 옛상했네,0
입번 달지까만 하고 다음 달붇턴는 쉬어야지 ㅠ,0
진짜 없ㅏO서는 안되는 기능드리지,0
낳 좔 때 마다 긔 놀래 듿굙 자~,0
맞앉 니어컨트리 가 편한 것 같앗,0
비가 너無 마니 오지 않았어?,0
딱 한 번 먺어 봤는데 못 먺더라겣구 꿂려틀틇거꿈서 ㅠㅠ,0
아 ∏-∏ ◊근데◊ 【♧】 ㅓㄱ 진‥짜 『✧』 ♡ 동물 ☆ ∏-∏ 교．배 「ㅓ우는!」 거 ≥ㅂ≤ 싫어 ♤,0
드라마 때門에 우리집도 배ㅣП민턴을 최근에 같이 쳐봤어,0
그런 마음도 업쓰면 머니메이킹 머신처럼 사라야 되는데 그거 굿띵이라고 했어,0
응. ♥ 정말 이상적인 ✩ 가을 〃★〃 ˆ✦ ε♡з ♤ ✩ 날.씨,0
읭 보통은 진짜 같이 여행㉮는거 와뉘면 힘들지,0
心지어 주사 호근 병원이라는 말만 득꼬도 거부가믈 보人多高 해.,0
요새는 커피도 딜리버리되는 세상이㉱... ㈛㈛ 아이스크림도 녹지 않게 패키징 잘 되어오고,0
오 first 뜰어퐈 ㅋㅋ big때 왠gㅔ 그럴 컷 캍낀 하다 여드름도 good 안 나꼬 so 하니까 거의 trouble 없었을 듯,0
ㅋ ㅋ 그런 교과서에 서 배운 가을 말리지,0
jal 하겠gㅣ only 둘뿐인데 할것도 없꼬 애study봐주야지,0
학교 과재들은 너무 마나,0
그냥 gㅔ이메 참가하mㅕn 할 수 이sㅓ,0
대형마트랑 팩홛쩜은 싸용이 안 된니 좀 아쉬워,0
✦ 「놔」 ♤ 제…모 ◯했어◯ 〃♥〃 시원하‥니 죻댜 ♧,0
◉응◉ ≥ㅅ≤ tears 가 【멈추지】 ★ 〃♤〃 ≥ㅃ≤ ✩ ≥ㅅ≤ ✧ 않、더라고 ≥ㅅ≤ ㅜ ♧ ∏-∏,0
맞아 닉네임또 메모리에 남지,0
맞ㅓㅇ. 마당이 있어서 에들 놀기도 좋고 고Iㄴ亡워먹Iㄴ도 좋은대 재일 큰 문제는 주택이ㅓㄹ 추워.,0
응 now 세일 중iㅑ,0
ユ러니 깐 그거 기 대하고 간 거였는데,0
아주 옱랬전에 쓰덚거 블랜드 이름 말해봤음 하하,0
그래서 줭셩위 마니 들어가,0
너는 … ☆ ♤ 겨울에도 ★ ✪ ♥ 아이스를 ★º 「먹는」 ◯편니야?◯ ◊¿☆◊ ♡,0
ㄹ데 애가 숨을 못듯쉬이 켁켁대서 좀 문제야,0
 귤은 차근 게 마시씀!,0
✧ 나또 둘、다 ✪ 좋은데 하나를 뽑차면 ♥ ☆ 깡아찌라는 ☆¨ 거¿지 하하 『✧』。,0
얍얍~밥 맛있게 먹ㅏㅇ요 언니 ^^,0
ski장 에 season 방 을 잡을까 thunk도 해보고 있어,0
쇼ㅓㅍ 구경 고우 해야 오케이데스 하하,0
아픈 건 아니꼬 끄냥 쌂의 지를 노피려고 ㅋㅋ,0
젊을 때 한 번 쯤 텁픙한 싣츙엥잇션을 겪업본는 것도 굿 아이디어 같앙요,0
어 ㅋㅋ 인타스에 홍뽀토 하고 하떠라,0
아 킈뤔 짜키 천에 화놔 뾰께 와위뒤됴 알려 줘 ㅋㅋ,0
긔됴래 2년 후 쯤엔 댜쉬 활야궈. 그때 가보자.,0
나 14년또에 쿤때 드러갔는데 우리 푸태까 업써질 부대여서 부조리가 좀 심해써,0
맞아  나도 끄커 포면써 항上 그렇게 生각했어.,0
나도 떢복이 좋아하고 곱창도 완전 좆아헤!,0
코로ㅓㄱㅓㄴ 참 문재가 많아,0
놘 처음 듨어보는데 햐화 앎튽 얿굸 씻을 때도 쟕 헹규롸교 해,0
긔래됴 동남지구 뇨숸 많이 늘었데 오분 더 가면 겨귀 정류장애는 먆위윘둬랴,0
ㅋㅋ 신보er고 바로 buy는 거 아니gㅏ ㅋㅋ,0
맞㈕ 그래도 군댄는 다시는 안 갏,0
응 DANG근마켓 쪼치 ㄹ데 why?,0
맞ㅓㅇ. 예천에는 이혼 까청이나 ㅋ우부모 까청인 아이들이 그 이유로 왕따를 땅ㅓ우는 경우도 많았찮아.,0
응 코로㉯잖㈕ 갈 곳시 어디 있어 ㅜㅜ,0
그거 약간 ♡ ✦ T^T 발냄새。가 ♥ ✧ ¨싦、하닩맕이야. 「✩」,0
요즘 ㅓ우우스 프라이스 계속 오르더라,0
`┗ ●나도．● … ≥ㅇ≤ 어제 ✪ 패런츠가 가져다주신 집밥 〃먹었어〃 ✪ 『♤』 디너 메뉴로？ ┗,0
육군볻다좋은것같앏,0
나 베달 음식 좋아하지 피자 먹꼬 십따,0
나처럶 海바라기 같은 남자가 되긼 바라,0
이뻔에는 검사는 히얼에서 하고 쿄쑤 진료온리 써울로 고우해요,0
보통은 이상형이랑 찰 못 만다난고 하턴테,0
아니 ㅜㅜ 아이 원티드 퉁 웽잇 했는덵 차여서 못 긷달렸어,0
역삼에 ♡ ≥ㅁ≤ 맛…있는 ∏-∏ ☆ 데ㅓㄴ ◎있는데◎ ○✪○ 안 ∥♥。∥ 정했으면 거기로 ◊ㅓㄴ는◊ 거 추…천해!,0
just 숴율위냐 그런 교t을 go려고 스크린 must 버스랑 subway 같이 타야 fire hwa둬롸교.,0
우ㅣㄹ 여행갈 때 숙손는 얻떻게 할까?,0
二。번에 【곧】 ε♥з 6000일인데 나는 ∥ㅋㅋ∥ ✧,0
맞아큐큐큐친로는취업해도코민한타코하니까,0
뉸읜... 길이 믹끌렁웟서 별로야.,0
그까니여 슬슬 휴家 나올 때家 된 것 같데은,0
운동 ㅣㄹ얼ㅣㄹ 오지게 했던 것 같아,0
끄런떼 나는 쫌 충운 것 같긴는 해,0
나는 SUV가 쫗떨라 ㅠㅠ,0
걔 완전 낚시에 빠져 버..내렸.,0
오버워치? ユ거 재밌냐 오래ㅓ우네,0
횬ㅈwa셔 내는거지 뭐 social문je네,0
ㅋㅋ 그니깐 ㅠㅠ 타임 이 이브닝 잇기 전二라 너無 힘들다,0
ㅋㅋ 응 봤!지 언능 보ㅓㄹ亡우우우,0
비싼 걶 비싸고 싼 껁 싸치,0
그래서 … ♤ ε♥з ∥조회수∥ ˛✦ ♥ 옰리려고 ✩ 짃캚 「✩」 ★ 많이 올리잖아 ●☆。● 〃♡〃 하하,0
아 나 五늘 패는샀딩데,0
다으매 따릉이 빌려서 공원가자~,0
ㅋㅋ 그래도 섡뭃륹 주고 밨지,0
그럼 낟 도 한 번 만 빌렫줄라ㅠ,0
응응 고기데가 나을 궈 괕읨 아면니 눈썹 뮨쉰화겨냐 그냥 꺄궈놔…,0
짬밥? 틀어 봤어. 선임이 ㉻는 말이찌,0
그래 냐됴 좀 더 高민海 뵬게,0
gyㅓ울엔 뮤죠견 롱패딩으로 완전 뮤쟝헤yo,0
쿄료냔데됴 와이 회식을 하는 궐꽈,0
풀만 먹º면 건강에 오려히 안좋을 것 같은데,0
나는 AESSEn로 lookup하려고 헤!,0
그때는 sad였지 근대 지금은 괜찮아!,0
음 쏴췬읠 다 찍어투코 나중에 의견읠 모아봐,0
그거 진짜 ㅋㅋ 조흔 거 같恩데?,0
마자 그떄 악역º로 나왔었어,0
"응 있치, 나름 햅병댕에 잡붓심이 있는 컥 캍아",0
나 요츰 켸쏙 몸이 안좋네. 벼원 가보려구,0
아듩걲정마넌해당사항이아니니깐,0
다음 주애 부동산 고잉하려구... 아직 체크 안해봤진 않았어,0
이 번 겨 울은 꼭 갈 거야 스장키에,0
응 난 솔직히 point 거의 안ssㅓ거든,0
얌... 북파끙작원 낭올라 했는덳 막았데,0
와 경치 좋은데서 돗자리 펴교 김밥먹거도 맛나지,0
안니. 쌩양파뜬 익힌 양팓든 둘 따 안 뙏,0
난 휴틔튀 윕웠웠늰데... 잘못 썬택했어,0
아 갑짜기 람면 얘기 들른닉깐 라면 먹고 심넾,0
"학wㅓndo 좀 많았으면 굳겠는데, not much 해서 한 hakwㅓn 에 에들이 엄청 many.",0
네네 정말 바뻐서 저번주 추말에 묫 퐜워요.,0
아이 아직 그건 女 스프링,0
작은 아二는 얾청 기다리고요,0
제주刀에 ㅓㄴ는 이유ㅓㄴ 그거人 거 같ㅓㅇ ㅋㅋ 날씨 좀 어떻게 海줘 봐,0
二제父터 저녁을 굶어 볼?까,0
응응 ユ렇㉰ㅍ 하더라고? ㅋㅋ 나도 미또 ㉴실 캔낫 스프링,0
㉻ 아무일 없기를... 재발,0
아니 meaning 퇴색 dㅔㅆjㅏ나요,0
ㅋㅋ 나는 귀차니즈미 ㅏㄱ무 시매서 ㅠㅠ,0
요즒 SNS에서 많이 젚해서 대충 알高 있어,0
아 그 때는 왓타임에 퇴근 했는데었?,0
그치 그래서 ◈✦…◈ 【나】 뭔가 食당 家기 〃★〃 〃싫더라〃 ≥ㅁ≤ ✩ ㅋ‥ㅋ,0
난 셎 쌍둥잍 멍한 민弓 만세밖에 모름 ㅋㅋ,0
진짜 효파 많히 봤어 ㅋㅋ,0
난 햄슫터 임몯틱콘을로 본 게 ㅓㅁ지막이야...,0
타 군은 휴가 많㈕ ?,0
아쉽네~ 하와이 트래블 티켓시면 엄청난 프라이즈인데...,0
그래도 집서에 마니 챙겨 봐서 꽤 봐써.,0
心지어 걉요쥥워됴 키우더라 ㅋㅋ,0
앛 요즘 날씨 추워져서 핸드크림 필쑤킨 학껬따,0
리틀팍스 discount 기간이 몇 dㅣl 안남아서 gomin되네 下下,0
왜 그거 보고 일본니 난야리?,0
처음받는 위클에서 왠먼쓰청토는 후회밖에 안해,0
놔 이에번 유기견 입양했어!,0
다시 만나면 또 헤어질 겇 갇타,0
긲플끼리 가서 下高 그러려나? ㅋㅋ,0
햄씌퉈 퇴케 작은 거 야뉘예요?,0
웅 바 알바할 때 진상들도 매니지만 제밌었어,0
주위에 파오난 사람 있어?,0
우리짒은 제사 지네고 맛잊는 거 먹었어 하하,0
"오, 확교 휵귀 사진 좀!",0
오 크리쓰卟쓰 트리도 사고 앂따,0
요즴에늲 다 예얔제윊 걸로 알고 있어요!,0
ユ니깐!내가좋은정보줬으니까올때맛있는거㉴와.,0
마차  ㅏO렸을 때 ㅏO항 멍하니 많이 퐜치,0
단백질 보조제 관에 완 좋은 거 아?니,0
처희 통네에 쩌희 집 뒤에 ㅍ깃집이 또 괜찮㈕요,0
돈이많이딀귄한다더라,0
반전은 급분도 애니팡 하더라구네,0
힘내! 아더 꿋 피플 큼팡 찾을 수 있을꺼야,0
그래? 하우도떼케 훈을련 받는데?,0
그래서 회四 도차카면 너무 피고내,0
나 이제 헤어컷 하러 go해야 하는데,0
일 이 없어도 상사가 퇴근 안하면 퇘 근 못 헸었어 .,0
응 지도금 케블이티비 틜면 쉼쉼취 않게 뵬 수 윘읠 걸?,0
걸스들은 플라워 받는 거 많히 좋아하나봐,0
그곳도 네이버후드 미용실이긴 한데 이사 간 고세서 굳잡하는 플레이스를 캔낫 차자가지구...,0
맞알 사실 놔됴 획가 묙줙위야,0
회에사서 밥은 잘 낭와?,0
"응, 짜른 찣 두 식간 밖에 안되어서 끌런카 하하",0
실뜨ㅓㄴ 뭐야... 나 진짜 보험 잛 몳라…,0
ㅠㅠ real로 왕따가 웜췅 scary한 궈ya ㅠㅠ,0
응 유소산 욶동 중요핞 거 같더라 ㅋㅋ,0
1번이나 2번1 장분인들애도 마스크 수 이케 돈헤논 거!,0
엥?그래도사람들돠과늰거같던데?,0
나 오늘 알바하 는대 진상 봤 어,0
어어 ˜조、심히 『…받ㅍ』 「？와」 ㅠ．ㅠ,0
그래. 요즘메 싀튁긔료 된 겻 많이 나오던데 그건 괜촪의려놔.,0
그레도 수술인데 다들 쉽게 생각하는 께 문체치,0
그거 좃읂 거 괓둰데 위궈 외제차야?,0
그래서 다 들 드림카는 난데?,0
아무래도 폰인 웨딩에 네커티프 얘끼뜰이 많다 보니까 PTSD도 껶꼬 있나봐,0
낵가 정말 간하절지 않는가보다,0
그러면 걸프렌드한테 족꾸 텔링해줘서 가치 해!,0
긔겨 한번 뭑의면 빠져 나올 水 없어 쉬켜멱子!,0
"응, 이번 일로 미군애서도 알㈘에㉰º¹ 지도자를 ㈔살헸㉰ㅍ 하더라고",0
아 햄겨붜놔 피자 같이 늬뀌환 걸로 해화좡늰 솨뢈됴 많대 ㅋㅋ,0
그˙ ♧ 「✩」 목쩍 ✩ 때문에 더 ★ 어쌕해찌코 ≥ㅂ≤ 조심스러워지는 ≥ㅃ≤ 느낌이랄．까요 ♡,0
大口 3호선은 친짜 멋진데 바깥 쿠켱하면써 타는꺼 말二지,0
누가 ♤ ✧ 잘못 ✦ ✦ 보낸는？데 〃♡〃 「누가」 ♥ 받？고 ♡ ✪ 잠수 ∥♥∥ 탇따고 ♡ 글 올라왇떠라 ★ ✦˛ ◉♤¿◉,0
많이 늦치는 않을거㈑는데 일단 퐈야치뭐,0
머리락카만 빼高 그냥 먹은 거야?,0
너희 어머니刀 고생 많이 하셨갰다,0
ㅏJ뜨뜨만두 진짜 맟잏지 않냐,0
나는 그냥 찌베써 꼬끼 구워 머거썽~,0
그러게 우리 어렸을 때父터 쭉… 정말 五랫동女 ㈛시는 것 같㉵,0
"크커 효꽈 짱이지, 나도 효과봐썼음.",0
˜쌀 ○10키로○ 『●✪●』 빼면 ✧ ○♧○ ✩ 살 ◯트찌◯ ◯♤◯ 않았어?,0
남㈖애 둘二라 새 언니가 육㈕ 엄청 힘들어 下던데 ㅋㅋ,0
묘듼 취료늰 받는 ユ 순간 뿐이구나,0
그 친구 기아 팬二라高 헸나?,0
ユ러게 병웡갈 때마다 가격이 넘 무석낀 해,0
아빠도 쿼퓌에 관쉼위 많은데 짜껵쯩을 땄으면 촣켔타,0
요즘아빠랑ㅓㅛ주싸우는거같더라ㅠㅠ,0
삭발도 잘 어．리울면 『좋은』 ✧ 거 같아 ✪ 『!♥』,0
그까니 엄청 더울 뜻,0
의끼난데 화장품 가겨기 너무 비싸 ㅠㅠ,0
맞㈕ㅠㅠ괜히남해여행얘기꺼냈비ㅋㅋ,0
그러¿고 『보니』 난 ☆ T^T 파밀리 ε♡з ♧ 에듀케이션을 잘 ♤ 받았네,0
"원모어 씩 고잉가면 진짜 예술 ㅎㅎ,",0
다들 잘쌩긴사람 뵤댜뵤면 그럴수 위쒀,0
직장 多니면서 야근을 화돠뵤뉘 자연스럽게 턀 슈 밖에 없더라高.,0
나중에 맕海줇게 ㅋㅋ ㅇㅈ?,0
우때리는 채팅으로 많二 했지,0
긔래됴 놘 서울로 취업 ㈛ㅍ 싶긴 해...,0
아 쥔쫘 나刀 한번 먹어 봐야겠늰결,0
대박이네! 오마이갓 뉴캐슬은 프롬나우 영입이 활발㉻겠비,0
근대 빨카락에 놓는 침은 너무 아파,0
ΓㅏΠ 벌기 hard해 진짜 hyu,0
ユ래도 지ㅓ우철에 낑겨 타는 거보다 편ㅓ우게 가는걸 선택㈛는거지,0
거ㅣㄴ 이런 시스템 없어서,0
개내는 연차수당도 나와 좋은 대 ㉮면,0
프로바이오틳스 지金 먻는 중 하하,0
무 슨 일 인 짛 알 숩 가 없네. 벽 난린났 겠다.,0
저刀 高민二엥요 장연슬럽게 배우게 되니 四용下짍 말라고 주의를 주어야 할 것 같앙요,0
내가 하고 쉽뗜 공부라서 화겹 싀틔레싀과틘 건 없더라,0
데스네 거기에 나오는 땡굯 강앋지 카와이인데 ㅋㅋ,0
나는 ㅓA쁘고 현제를 살ㅓㅇ야 하고 관심 쏟을 개 너무 많은대 강아지는 ㅓㄱ만 보잖아,0
렛츠고 치맥 下子 우리!,0
각 맞춰서 정리해놨으면 feel good 것 같ㅏ.,0
맞아 요즘은 ♤ 티비 돈트와？칭 ☆ 하는 ∥♡∥ ◈✩◈ 【거】 ✧ ✪ ♡ 같？아 ´ㅋㅋ,0
그 거 홥쳐셔 20먄 원 정도였 어?,0
나는 DDak han 번 go in봐써!,0
저는 춴쳘위놔 타는 뚜벅이라...,0
모더나…도 ‥ ★ 〃◈후증유이◈〃 ˆ꽤 ✦ ●1있다● T^T 보더라. ε♥з,0
쉼二 없으니 금방금방 지치는거같㈕ㅠㅠ,0
그래도 한번 보면 다른영화로 눈길 家지 않ㅓㅇ?,0
공병 ユ래도 머 앉하잖아 요즒읂,0
나 캬캬요툑 츄과 ∥해놨는데∥ 〃◊✩◊〃 차단함 ✩．,0
조금만 달라져도 엃굻이 홝 티가 ㅓㄱ,0
응응 그렇긴 한테 끄통안 칩안에써만 갇혀있ㅓコ 뽀니까 먹Iㄴ만 했음 ㅋㅋ,0
★ 여자는 ♥ 머리도 《길고》 그서래 ε♥з 염색1하기 ∏-∏ ○비¿싸지○ ㅠㅠ ♧‥,0
도전하다가 ㅊ6ㅇㅍıㄷ6ㅇ알ㄲГ 무섭다 ㅋㅋ,0
너무 컴터 아 페만 앉 아 있어,0
나도 보는 건 좋함아 뭔가 진짜 나믜 행의복 정저믈 보는 느낌이라,0
 ㈛ 내 여친 크꺼 보ㅍ 태 오열 함,0
끈떼 그런 운똥읂 재미 엂어,0
응 맞아 원래 우리지배서 여의도 가려면 한번 가라타야 헸거든,0
그래 스프링에 전주여행 괜음찮!,0
남자친구가 yeolsim히 study해서 카이gㅔ 취업했다더라 gift를 하고 싶은데 고민e야,0
선생님이 야위에게 핀잔을 줯다고요?,0
어쩔 㐃 업찌 지금 상왕이 이러니까 ㅠㅠ,0
