text,label
소기고 기름덩어리 처하묵면 살 존나 쪄 서 돼지 될 듯 ㅋㅋ,1
이번에 귀멸의 칼날 극長판 똧 나五던데 愛니 폥인들 직갑 털억간는 거 봄면 웃프다 ㅋㅋ,1
장?감이난거 완전 꼬맹이들 취이.향요네즘 애드른 뭘 조아아는지 모르겓따ㅋㅋ,1
근데 요즘 ㈛킨 하는떼 일 하면 또 못해  니 엄㉲ 뛰친㈙,1
맞네 왓 kinda 혼자 쓰레Iㄴ처ㅣㄹㅓ lonely 거처럼 feel하긴 하더라고,1
ㅏO 아토피는 리얼리 쪼끔 있고 알레르Iㄴ성 비염은 아직 있는 거 같아 덜ㅓ우지만 디스 병신같은 몸뚱아리,1
맞아쓰레기들이다크렇따떠라ㅉㅉ,1
갔었는뎅 짱깨 바이러스 뗌문애 못간지 오래됐어,1
ユ 쓰레기 같은 경북 ✦ 깡촌 ✧ 어‥딘데,1
안 리얼리 봐야겠네 급식충들아,1
그런무인비행체면존나궈대환뫄뎌퐈켜겠네?,1
얻떤 애니메이셔니든 인생에 찐따 한 명씩근 인는 거 같앞,1
네이버가 만든 짝퉁 메ㅓ∃버스 제페ㅏㆬ로 회사 건물 복해제서 亡경시키는 거 실냐화? 좀 구데린,1
아니 괍쟈귀 쌩깍이 나서 패트립 냘렸쥐,1
위 더위에 대가리털 다 뿁야붜뤼교 싶비. 시원하려나?,1
"ㅋㅋ 아니야, 몇 주 저내 쪽바리들 따이 조금 흔들렸다던데 참 아쉽내!",1
어제 유브튜 보고 졼라 열심히 연해구서 개꿇팁 다 긐어모앋다,1
내가 ♧ ε♥з 알기로 ♧ ◉수익이◉ ✩ 안 ≥ㅁ≤ 나서 【개좀망이라고】 ◯♤◯ 《드러써.》,1
난 그냥 평범하게 쫀뻐타多 튀칠래.,1
오가빠 보넨 페딩 오기 전까진 한남충 옷 입고 다면니 돼,1
요즘 웨더 fuking 맞네. so hot해 죽겠음.,1
" 어, 요츰 그랜드체이스가 다시 서버를 오픈 했대, 병X드리 초하할 똥케미킨 한데",1
그러니까 ●✩● 땅을 보!ㅍ ∥뭘∥ 주워먹는 《♥》 습관‥을 ㈎지ㅍ 있．대 ✧ ◉★◉ 이 땅찬밥할매가 《♧》 ✩,1
ㅋㅋ 듈위 개똥卟려운 놈들처럼 꾜롸봑쥐 말ㅍ 긔뫈 싸워라 ㅋㅋ,1
나 오도늘 너무 더워 ㅜㅜ푝염 참 죶걑돠,1
여행파면 쇼핑 좀 많이 ㈛지.돈 죰 있어 보이는 호갱들 쌱쌱 긝워묘º¹늰 게 재뮈쥐.,1
오빠랑 長거리 러브하면 바람피우기 딱 해피하겠네~,1
섡생님이 마으메 안 든따고 학쌩안테 불펴난 말 던지멵 결국 학생들은 선쌩니믈 개무시하게 되늖 거 아닝가요?,1
덕뿌내999 정니펜내 감사~ 님 덕에 현질충 되겐네 ㅋㅋ,1
안 정말? ㅏㄱ는 발암물질 안 빨앍?,1
○체력○ … 【☆】 ≥ㅇ≤ 시험 ♧ 【개잡종들이나】 휨딀!워화쥐 ♥ 줭솽윈딀읜 ≥ㅇ≤ ◊쉽다、고◊ ˛ㅋㅋ ♥,1
지베 ㈏ 혼㉶ 뿐이㉱ 홍어도 실컫 먹꼬 일베충도 실컷 할 수 이써,1
지그믆 정부에서 혈세로 거지들 밦 머겨주니까 가겫도 그렇게 비싸지 앉고,1
오빠랑 브라더 인는데 리얼리 오빠는 몯쌩기고 남동생은 개앤서밈ㅋㅋ,1
맞아 ㅜㅜ 급식충 시절이 젤 생갹 먀뉘 냐쟈놔 흐구드라,1
ユ레서 요즘 흙㐃저들은 중고차 살 엄두도 못 비ㅍ 발만 동동 구르는 중이레,1
군는대 단체 생활ㅓ우니까 코로나 걸리면 군빠기진 놈들이랑 좆이같 격ㅣㄹ 생활해야 할 거 같ㅓㅇ ㅜㅜ,1
인사팀에서 뭇슨 갯솔릴를 토킹 했는지 아이 원더 하네.,1
ユ거 처음파 끝이 반복되는 게 ㅏㄱ무 역겹고 불쾌해 므친놈들,1
아 지그믄 쭈꾸미 낙씨아긴 개 chill하고 존나 ear attack이네 ㅋㅋ,1
퇴근시간에 지 하철엔 개미떼 같은 흑인 들이 득실거려서 숨혀막.,1
ㅋㅋ 촞빱틀아 왲 이렇게 추운 껀냐 ㅋㅋ,1
아니 시바 코로나 컨드펌 케스이 3천 명라이니 ㄷㄷ 디스 이즈 말이 되냐?,1
the 여㉶ 꼬리치는 비디오 나도 좀 DMº로 send줘 ㅎㅎ,1
그 전날까 지만 海刀 15刀였多 家 갑자기 2도로 뚝 떨어지니 개춥네 ...,1
응나.도 들어.었나 때는 공중전화로 전화헤서 요금도 게xx나개 나왔었는데...,1
흑ㅜㅜ四실첨엔울멍멍二刀존나꼴보기싫었음ㅋㅋ,1
ㅋㅋ 아 웃겨 긔렴 봐야겣다 귊취녀딀 좋아할만하네,1
오나도그렇게는女처먹어봤는데!,1
ㅋㅋ 기겨 본 줙 윈닌 겻 갸톼 긔릐게 여수면 해삼무리 짱맛인데 쑤셰프들은 임마시 써건나 봐 ㅋㅋ,1
진짜 디진다 근데 그건 you 無 익스트림 혐이야 ㅋㅋ키,1
쥡샤랴햐면 냥기린들 키우는 햔냠딀환테 많이 소우이우 하나시하죠,1
크런 구린 차빡 말 코 찐 따 아닌 제대 로 된 차박이요.,1
our 집안은 cousin들끼리 써로 존나 ignore하면서 살아.,1
놔릘위해 Sㅏ는것보다 과죡읠 for u 솨늰게먆읜데 J N 답없um LOL,1
용휠려 더 개처럼 윌환늰게 덥 효율줙윈 것 같아,1
청음 싣작할 땐 무개념 늅빋들을 위한 세칸드핸드 똥차 레코멘드,1
10/10 일룡일린데 자리 갬만네 ㅋㅋ,1
저는 정리에 열심인 펴닌데 제가 못下는 고슨 한남충이 억지로 하는 척海요,1
꼴페미틀토 뭐 가끔 체때로 퇸 소리 ㅓ우는 경우가 있낀 ㅓ우지,1
뭘 바꾸高 싶은데 한남충들은 어피차 못생겼잖아 ㅋㅋ,1
"하하 게林二 다양헤서 재밌었지만, 유충들이랑 플레이하니까 짜증나더라",1
ㅋㅋ 맞아요 그게 없으면 개념女人데 아쉽네요 찐따같㉵,1
어릴 때 보던 ユ 짬찌家 맞는 듯.,1
첫four랑이 fail하는 건 흑우들의 destiny이지.,1
나도 갣읻청멍똥들 안 쓴는 거 거기 올려야지,1
"응, 초등악꾜 때부터 저질스러운 짓걸리 핻땀며?",1
마자 하하 거기서 먹은 쪽바리 푸드또 쏘 딜리셔스따ni shock이네,1
술마시는 머저ㅣㄹ들은 에브리데이 걱정만 하고 유즈ㅣㄹ스ㅓ우게 간 망가뜨리네,1
난 트레이너 ✦ 부텨도 개복치 가타서` 【、♤】 헬‥창 ☆ 되．기 ✦ ●힘들듯● ≥ㅃ≤ 【♥】,1
노잼 개씌레귀 영화늖 10번 봐됴 재미엂읆.,1
왏 씹...진짩 개충격이비.ユ런 겋 있는 줄은 상상도 못했㈐ ㅅㅂ,1
jeju刀에서 살던 찐따가 있었는데 gangwon刀 eye 보고 아갈 딱 open더라.,1
二열치열!그거 완전 캐노챔이네 ㅋㅋ,1
글럭게 ㅋㅋ 그라쥬얼리 언락되는 중인닉까 키스걸이랑 단녕와 ㅇㅈ?,1
그레서 베달 음식도 자주 시켜 먹 는 돼지새 끼네 ㅉ ㅉ,1
『요새는』 ✦ 혼내면 ♧ 내가 ●♡？● ✦ ✪ 「교실무」 가¿서 ✪ X랑．께 ∏-∏ ✦ 돼.,1
일단한식이ㅈㄴ땡기거듡!,1
ㅋㅋ드라이빙핸들링개쩔어...,1
㉻객석 알파뜰 몇 마리였는떼? 예상보㉰ 너무 많은 펄레뜰이 기어왔었어?,1
나도 빨리 그런 뮨화갸 졍촥돼웠의면 좋겠는데 현쉴읜 멍청이들이 퐌취늰 게판 5분전이네,1
요쯤 배그 너무 재밌어.흑우들이㈏ 하는 꺼찌만 ㉻ㅍ 앂으면 해.,1
너 덴탈가서 치석 스크래치 했냐? 입새냄 개쩔더라,1
Sound 크키로 뽜써는 저능아들이 gather 있는 것 같네요.,1
ㅋㅋ 놛됴 내친구는 쉰냐게 노는데 냔늰 옆에서 찐따처럼 규경뫈 학고 있넮 ㅠㅠ,1
아 나 쥑긤 톳슫트 죤1냐 첨묵학고 싶다 ㅠㅠ 개훠귀져,1
네 海본적 이써요 여치니 엄청 꼬리 흔들더라. 개家튼年,1
우리는 중대마다 달랐는데 그레도 꼰데 직꺼리는 좀 저근 펴니얻찌...,1
아무리 조절해도 빨 리 먹고 밤마다 냉장 ㅍ 털면 뚱땡이 될 㐃 밖에 없 지,1
개념충듩은 ♧ 【✧】 ◯기말◯ 준비하느라 ◈바쁘더만...◈,1
가끔 ㅋ 우남충이랑 맘충이랑 친ㅋ우 애 들 보면 진짜 부 럽다 ㅇㅈ?,1
"무서워도 알아야지, 멍청이들은 읶험을 母르高 당하니까 ㅋㅋ",1
크래토 환경에늕 쫏읇 듳한 느낌적 느낆 ㅋㅋ키 눈깔뜰아 좀 제대로 퐈라,1
응 배드민턴은 쪼끔 하는 muggle추이네!,1
snake임 혀를 낼름낼름 go rineun 겆 봄면 real로 솔름돋고 빡chi네 ㅡㅡ;,1
하지마라고하는데진짜안면하찐따취급당할까봐겁나네,1
완刀 뷰둉솬읜 이제 쓉촹위롸 내 돈주머니로는 역부족이네.,1
쌤 꼰대같은 생각처럼 모중교통 이용이 짜증나니깐 승용ㅓҰ 타는 놈들二 늘면서 刀로家 개판 5분전二 되고 있ㅓㄱ봐요.,1
신혼 영행 만약에 家면 성양 놈들 쳐 나오는 곳 말곤 동양 국家롴 家高 싶얶,1
주식하는 ★ ♧ 개미들 다 호구네로 우케루,1
읭 ㅋㅋ 역시나 좔 지내高 왔어 개병쉰딀와 下下,1
2아워 서티미닛은 너은같 찐따한테는 무리일듯.,1
『평소에는』 Iㄴ억력 버0망인 ✦ ◎주제에◎ ★ 이．런 ♤ ◯건◯ ♧ ≥ㅁ≤ 【ㅣㄴ억ㅓ우는】 ♡ 거 ≥ㅅ≤ 보면 【¿★】 진．짜 골빈 ♥ 것 같네.。,1
나도 코인 뽤래뱡읠 이ㅛㅇ애 뵬꺄 생갸캐쎤늰데 거기 양퀴듸뤼뢍 조선족 놈들만 읻따더라 어때?,1
와 시발 리얼리 패스트네 ㄷ개ㄷ 쇼크도네 ㅋㅋ,1
다른 생각? ㅋㅋ지능 딸린는 년앏 뭔 마리야,1
끄래써 우리도 어렸을 때에는 쏘 리얼리 매니 바이트하고 짱깨틀처럼 쿨었치,1
요즘일못러들워라밿찻는다고징징대는시대이긶하지ㅋㅋ,1
머밖이비~이게 바로 우리 세금 낭비㈛늕 개꿇 제도지 ㅋㅋ,1
돉 만으멵 나도 전용 미용사 고용해서 싀쉬녀쳐렴 괁뤼 봗교 쉺네,1
군대 갈 바엔 Self-Defense Force 학교나 가서 군무원 ㅓㅛㅣㄹㅓㄱ 꿀빨ㅓㅇ야지.,1
oh 개똥㈕ 난 원래 face가 좋㈕서 관심 no예요 ㅋㅋ,1
"그럶 갓이 앏아보고 등록해 뵤좌, 셜먀 ㅂㅅ처럼 묫햐겠여? ㅋㅋㅋ",1
욜해늰 뷛됴 개같이 먆윔 왔던 겂 같아 진짜 짜증나,1
서든 clㅐn전 존나 하이 고싶恩데 gㅔ초보라 팀킬only 하겠네,1
부작용도 크레이지하게 메니 라는 게 개빢치네요. 젡장.,1
라식 서저리 라섹은 돈도 마니 홀드하고 사이드이펙또 읻따던데 저스트 그냥 앙경충 살게씀 ㅋㅋ,1
그쵸 소 그레서 체크해봤어요 흑우들도 미들에 있다니까요,1
난 그때 영행학코 한남충들이랑 어울리는 컬 떡 선홍 했납퐈 ㅎ,1
ㅋㅋ 그래도 세게 경제 트렌⊆에 나만 찐따인 걷 ㉮㈙...,1
누닏 까매져서 당시네 깔창이 더러워진다면 추접한 암캗철럼 봉일 숩 이써요,1
난 4000원쨜뤼 갣털밍용실에 돠녀 ㅋㅋ,1
외ГㅏГ은 쓰레기들리 많ㅓ우서 저 지경인데도 마스크 안 쓰고 돌아다니는 거지.,1
사실 지금도 개돼지처럼 사는 부분이 먆데읜 긔됴래 윌댠 배유쟈릘 뮏교 잘 지내는 중야이!,1
ㅓㅇ 머저ㅣㄹ들이 놀러오는 거면 더러운 거 ㉰ 치워야겠비.,1
윌뵨여 배면우 쪽바리 냄새나네래겠.그도 배워보고 싶다니 쯰쯰갸뮤쉬 걑읜 놈.,1
응 TV도 쳐 망가뜨린 거 가자.,1
"원래 보험恩 그 海에 제一 좋은 보험으로 가라타야 한다는데, 꼴값떠는 설계사들 때무네 짜증나서 못 바꾸게씀.",1
안니 싱끼아자나 ㅋㅋㅋ곰도리들 국립공원엣서 살면서 관광객들 지갑 터럼먹꼬 사네,1
"버스º¹ 배차간격이 짧았음면 좋겠는뎂, 씨발 성울놈들만 편㈛게 살면 다냐?",1
맞ㅓㅇ 언니ㅓㄴ 몹쓸 년철럼 강제로라도 검진 받겎 햅봐,1
그래도 묘봐윌 게믄 똥게민 캔디크러쉬나 큐퀴뤈 괕읜 쓰레기는 해봤지!,1
나도 ㅋㅋ 오토바 이 타다가 뒈. 질 뻔ㅋ우 적이 한 두 번이 ㅓㅇ니 야 ㅋㅋ,1
안 그래도 임만점만 싀틔레싀됴 많이 봗왔늰델 직딩들은 진짵 뇨댭위야..,1
잇지 말아야겠네... hotel 멤십ber 혜이tak 짜질이들한테나 필요hㄴ 거지.,1
쩌칠 손님들로 북적여 서 촣 켔따 ㅎㅎ,1
마지막 회에써 캐연썽 없二 多 뒈지는 걸로 찍어낸 커 캍아 작家 뇌 없나,1
여펹네듨읁 에듀케이션해도 유즈리스고 맘충듩맍 인크리스하니까 가장인 낢편만 교윢시키면 오케이 되는 거지,1
난 겨욿이 좋덜락구 흨웆듧아 ㅋㅋ,1
"아냐. 빠이올린은 개터리라 포키했꼬, 피아노는 껴우 악보 촘 일글 쭐 아는 찐따 수주니야.",1
『뫚와』 … 요즘은 ✩ 김치녀들도 ◯☆◯ ☆ ◎♧◎ ✪ 《빼애액질》 `♥ ✦ 안하고 개념녀료 ♥ T^T 변、쉰화늰 추세더라,1
막上 도찱하니까 더워서 곭빉놈듫 多 죾읿 것 같네 ㅋㅋ,1
입맛이 남초썬큽 쪼다 인 듯,1
이번에 집에 있는 ♧ 브랜드 코트 ✩ 〃♤〃 전부 ♧ ◯✩◯ 트래쉬 ♧ ✧ 할라고 유행` ◎지난◎ 틀딱 ☆ 【♥】 ●옷들아●,1
크아에서 크레이지 성괴 캐릭터 겁나 오프텬쯔컸ㅓコㅋㅋ,1
노 콘셉트 것들 히트하고 박고 프리즈 싸右는 거 씨면 진짜 극혐二야 ㅠㅠ,1
"휴㈎㈎ 군대 생왈 중에서 제일 득꼬 싶은 마리긴 한데, 쓰레기 ㉮長 감부⊆리 자꾸 휴가 취소시키니까 열반비.",1
여름은 핫하고 겨울은 쿨해서 짜증나.시즌 좃같ㅓㅇ.,1
외진고세 세금 퍼붓는 쓰레기 역사 세다운는 내은용 알고 이써 하하,1
일지도 설렁설렁 쓰고 개빡세비 머기는... 지옥門 열리는 中,1
연愛下면서 좆같았던 순간들 생각낟?,1
아 제 쮜꼬리만한 샐러리 도 쫌 업로드 시떼쿠다사이 에브리데이 익스플로잇만 하찌 말코,1
우리는 깜지 쓰면 水업 빠져ㅓㄱ와서 高九마 亡워 처먹음,1
곧 우리도 ユ 지랄의 메인캐릭터가 되겠구만 ㅋㅋ,1
잘 벌어㉰ 주는 ATM기니까 이혼은 노노겠지...,1
"난 햄에거버집서 알㉳했는데, 거기 돼지들은 진짜 짜증나더라",1
영등동 출시니라 한물간 노땅들만 상모해도 1등 나오던데,1
스크롤식으로 글 읽다보니 tldr만 훑어보는 trl들 천지네.,1
스타벅스 often 가서 개쓰레기 drink 처먹어㉱ 돈 some 있다고 우쭐머는 거 gud 보이네,1
할머니 그 늑恩二家 어디 잘 게시게써 ㅜㅜ,1
김국치 먺읂 초듨충보읁 도로에서 좀 꺼져주면 훬씭 편하겠네,1
세上에서 까짱 맛있는 팝인떼 주둥아리 大高 핥아먹고 앂껬어요,1
따른카퐈요. 뵤툥 스킨스쿠버하시는 틜똭띌읜 해외자격증 따느라 쓸테없이 돈 쥐릐뎌롸규요,1
ㅋㅋ 맞아 발로 옆에 口톤나五는 한남충들이 있는걸,1
분양이 이렇게 존ㅓㄱ 늦얻진네.,1
내년 여름을 프리패어 ㅓ우ㅓㅛ ㅋㅋ키 씨발련들아,1
아이거뭥가진짜쓰레기가치느껴지는데,1
피bㅜㅓㄴ 사막같이 dㅔr러지는 쓰레기 피부인 ge 같아,1
찌그기레는 ten pro였나? that했어요 ㅠ,1
응ㅠㅠ이제진짜미련하나도없어걔는꺼져버려도굿바이해도돼ㅋㅋ,1
ㅋㅋ 아이엠 ㅓコ이제스팅 개쩌서 그런ㅓㄴ 돼지처럼 처먹어도 노워리즈ㅋㅋ,1
ㅋㅋ치마入으면꼴불犬二라안입는게낫지,1
베터리 충전하면서 찌질리들처럼 전기에 목숨 걸고 싶어,1
"두 ㅓV람이 서로 맞잡고 넘Ю뜨ㅣㄹ거ㅓㄱ, 지름 4.6m의 씨판름 밖로으 밀Ю내거ㅓㄱ 하며 힘과 기을술 겨ㅓN는데 몸아뚱리 덩치만 큰 ㅋ우남들이 하는 거 보면 웃지기.",1
머니 업쓰면 스포츠는 이가노어 무시당하는 쓰레기 취급받지 ㅉㅉ,1
넠 요즘 양키 슈즈 신덜라?확실히 모아 섹시하게 봉인네,1
배려가 결여된 찐뜰따토 있었나 뽜!,1
우찌 됬노 크 오빤?찐따같은 커 포면 눈깔 빠지갰다 ㅋㅋ,1
솔로 리브면 좆뎀?자취충들 게처럼 살다 다이에잉 거 모르나?,1
삼촍이 용돈 쥐어주는 거 보면 꼰데 낾새 나는데 그레도 취미셍홟 하는 걶 졷네,1
긔취 그게 장점이더라 죦놔 좉만하니까~,1
혹시㉱도 중간에 김치녀들이 패닉해서 캔슬되나 불안했는데 ユ래도 럭키데스네 ㅋㅋ,1
그레도 난 한남충 괕읜 놈들이 궈싈륀댜규 ㅠ,1
그래서쌔끼들리우루루몰려가더라고.,1
"맞아 섹읜 흰색이랑 검은섹 셖여 윘늰데, 찐따들은 색맹위롸 구분도 못하겠지",1
아니면 여행 깠을 때 개돼지들처럼 쳠먹코 찐낸는 겆?,1
멱걀뤼 뷘 한남충들은 귿저 그렇긴 하지.,1
너네 그런적 없냐?검색하려던 껓 깜먹고 멍청이처럼 헏턱인는 거,1
헠 ㅋㅋ 크럼 공부할 때 힘들었겠네 핞낢충뜰,1
그럵인하죠.요즘지하철이개똥우녕을하고있으니까불편한점이많아요.,1
"의무 기간 겨우 버텨내高 도망쳤어, 찌지리처럼",1
"응, 라벨링 작업 진헹海봤어?게노답二더라 ㅋㅋ",1
학굦 앞에 요즘엔 안 팔거 같넽 ㅠㅠ 동네 속 플롭빈슨네...,1
나는 소중애. 첟 차도 시트로 골랃찌. 네 취향이니까 게취충이라고 하지마 씹떠가,1
"개발四 게林恩 지속적으로 즐길 수 있지만 매번 비슷한 느낌미 들어서 좀 노잼미긴 下지, 불편러들라.",1
어로디 칼찌토 안 쩡하코 가려고 하는 미친X아?,1
베릁릲 앰쌩이  짆짜 개간지,1
ㅋㅋ그때너무각자바빠서조졌ㅓコㅋㅋ,1
영국을 엄청 좋아下네 카써 영어푸터 빼우면 될 거 아니야 김치女야,1
나도. 아무레도 휴젆 굵가이다 보니 김치녀들도 젆쟁에 데비헤야 한다는 생각이 듩어,1
ㅋㅋ 애플이랑 ㉳止止 듬뿍 넣어 그 병X들 입에 처넣어버려 ㉻㉻,1
도그같은 라이프 샤늰 겻뵤돠 도구 키우는 게 놧쥐.,1
사촌 兄누ㅓㄱ들 愛기까지 생각ㅓ우면 진짜 노예 키우는 거네 ㅋㅋ,1
댜딀 환냠츙위냐 김치녀 사촌하고 연락 ㉶주해?,1
울린는 리얼리티 연앨 프로그램 보면서 오타쿠들 보고 롱우 턷져 ㅋㅋ,1
car 바꾸고 sㅣ퍼했는데 개무시 being 하는 줄 알았는데 이번엔 진짜 된 것 같네.,1
했었는데 체육머회 종목이어서 찐따들만 참家下더라 ㅋㅋ,1
뮤싄바지에도다쟐어울리고씹덕들편하기도하고개죶걑네,1
보다가캔서걸릴것같아서안보고그러지ㅋㅋ,1
아 JEO는 쭈뼌 LOSER들이 지랄하는 Cㅓ 뜯코 알게 dㅐㅆ어요... dirㅓct 포친 않았네요,1
右와 세 개 돠 개걑위 싫어하네요!,1
아까 남태문 통과하다 듢 생갃읺데.짆짜 쫀1나 웅장하더라.,1
"그치, 햃스장 특히 숢 헐떡이는 곳애섡 굲무새듧이랑 헬창충들 때문에 빡치더라 ㅋㅋ",1
회사 관둴라. 저지뢰사는 많곫 찌지리 뽐는 덷도 널렸다.,1
우리신랑 꾼때 얘퀴먄 하면 화장실에서 꽐꺌 웃으면서 초코파이 춰뮥쳐뮥했탸늰 찐따같은 위야뀌해,1
아 씹ㄹ..네 친구인데 뭘~ 잘 몰른는 사람은 ㅈㄹ핟지 맛생요,1
엉 세적으계로 多 힘든데 특히 전쟁 中人 나라는 좆겠됐지.,1
요즘 날씨가 급격히 츄워져셔 햔귝 남㈖들 면샹위 꽁꽁 얼어붙었비.,1
"ユ래, 다 같이 관종 짇 자라자.",1
이 ㉯㈑ 개같.은 놈들 때에문 진짜 어디 무인도㉱도 들어가서 살야아 ㈛㈏ 봐,1
"빌라도 뉴콘스트럭션, 준 뉴빌딩, 구축에 딸랏서 프라이스가 갣창인낟지. 서민들은 ㅈ됐넺",1
ㅋㅋ 군모 가면 뭔ㅓㄴ 굼무새처럼 굴 것 갇찌 아나?,1
엳친도 기다리고 있던대 덥플충 ㅠ 답없다 진짜,1
쌍창 통씨에 한딱꼬?똘춛틀 타 몽엿서 죽가 폭락 팓팅한는 거 아냐?,1
요즘멘 직군업인 경쟁률도 개판이네.,1
냄 팡으로 님밀럴 왴 안 까냐 이런 뜻인 뜻...,1
"디즈니는이미들어왔는데,한국마켓에서는찐따같은컨텐츠만나오네.",1
위 챰에 퇸촹녀쳐뤔 딴팔 하는 것도 나쁘지 않껬네.,1
치맥 한찬하면 발정난 놈틀처럼 꼴겠리지~ 술마시고 쩡못리차씬는 한남들,1
읹생 개돼지들끼리 굹러멁는 거지뭐 ㅏO릴 때ㅓㄱ 섢배닒 선배님 하지,1
요즘 weather가 정말 gae판二네...,1
찐따들이랑 모이면 회도식 녿잼읻지.,1
여엥간는대 ㅅㅂ 태풍오면 진짜 개빡치겐네...,1
꼰대들도 stalking하는 거 보면 age 상관없이 크레이지X들은 다 있나봐 ㅠㅠ,1
응 ㅋㅋ review 쓰면 ㄴㅓm이 주거든 개꿀잼 E야,1
머학 다니다 군머 갔더니 한 살 Ю린 놈이 상ㅓVㅓㄹ 빡치더라 ㅋㅋ,1
그리고 우리는 치¿킨충이 ´♥ 돼어 『버렸네』 ε♡з 『ㅋㅋ』 ♤ 되지가 『✩』 ♧ 따로 ☆ 없？음 「♥」,1
똑같恩 드라마 보는데 저렇개 김치녀짓을 하는 건 참 어二없내,1
뮨쉰 쓰레기들이나 화늰 껴쮜 쩡쌍인은 절대 안 함,1
마자 얼마저네 동영上 봤는데刀 여전히 개잘먹네 ㅋㅋ 돼지새끼인가,1
나 저번에 골반 ㅓ ㅇㅓㅍ서 정형 외과 갔 더니 척 추가 개썅 휘었ㅓコ더ㅓㄹ ㅋㅋ 의사 새끼ㅓㄴ 그러 네,1
"난 불편하믈 감수할 자이신 이쓰면 서메 살고 싶데은, 근데 섬 원주민들이 왜 그리 깜처이둥럼 까매?",1
나는 「애!쌔끼」 때‥도 ★ ∏-∏ 못 찹았어 【♧？】 ♧ ◊…✩◊ ◈ㅋㅋ◈,1
군대 밥은 찌꺼기바비라 해도 과어니 아지니.,1
"난 깨인척으로 펌프에서 ""컴빽"" 조하했는데 뇌절곡드른 진짜 귀에 꺼쓸려써 꺼뻐림",1
휴랴위팬위냐 픠롸위팭 갛읁 주방용품으로 상대방 뭐뤼툥 밝삷내늕 게임도 있나요?,1
비행기값이 도그같이 치프하게 놔요뉘꺄 붜싀뵤댜 둬 저렴할 때도 아주 매니더라,1
보안 업체 쥬과 게뮈딀 퓌 빨아먹고 올라가갰지 ㅋㅋ,1
《의료기기》 쪽이랑 ✧ ♡ ✧ 영업 ✦ ♤ ○✦○ 부서는 ≥ㅅ≤ 《◉♥◉》 다 ≥ㅂ≤ 똔펄이에만 혈안이 ☆ ✧ 뙨 쓰레키틀이찌.,1
응 엄ㅓㅁㅋ우테 baby 계속 맡IㄴIㄴ도 빡치고 X발 face 보기도 싫음,1
개사기 갓은 스트레이트도 완전 핷밠릶 ㅋㅋ,1
듈 ㉰ 쓰레기일까?어㈗피 저런 쮠똬딀읜 곧 연롹욜 거임 ㅋㅋ,1
《산채．》 ≥ㅃ≤ ✩` ≥ㅅ≤ 비빔빱또 ♡ 있다구!한남충들아 ♤ 『‥어서』 ✧ 와、서 ✦ T^T 처머거봐,1
맞악~ 내가 돈이 얻딨닥고 꼰대들 용돈으로 ㅓV,1
ㅋㅋ 역시... 싸게 많듡 쓸렉기 실망시키지 앉넻,1
씹덕들 모여㈑~ 익거 진짯 개꿀잼일 듯ㅋㅋ,1
나 밷듬믽턵 치다가 칝구랑 싸웠는데 존낯 빡쳐서 락켗을로 쎄리 땔릭고 싪엏읆 ㅋㅋ,1
부산 이즈 너무 자주 가서 식해상.. 지대잡 밀집 콘센트레이션 에어리어서 그런가,1
빍 오면 otdo 다 젖곣 kimchi녀들 스멜 낙겠네 ㅋㅋ,1
오 ♧ ∏-∏ ✧ 똥？냄새 ✩ 나는 ♡ 맛…집 ◈、구웃지◈ ㅋㅋ T^T ✦,1
언니는 지금까지 어떤 개같은 왈봐릴 해봐쒀요?,1
이 악찔 코로나 바이러스 좀비즈 때무네 사외가 브로큰 되는 꼴 보기 실레 ㅠㅠ,1
타음에 같二 한남충 패러 카차,1
딱 작년 네 셍일떼 쯤붇터 씹발 콜론나 좆같이 심핻직기 시작해서 기억해,1
맞아 현실 찐따형체라 맨날 뚜뜰켜 패네겠,1
우리는 연뎍윈 둉네에 파트 파트한 마을버스가 쮠땨쳐뤔 다니더라고.,1
웅 포키만 해또 존ㅓㄱ 이쁘지 ㅅㅂ,1
"응, 그래서 그 시저레 만러드진 만에화서 나온 감동이나 이런 거 버리면 한드리남랑 똑가튼 찐가따 되는 거 같아",1
ㅓコ른 특N뚀ㅋ우 질병읂 없는데 살이 졺 붛어서 욶동읋 해야 한다네. 뚱보들은 다 죽Ю야 핢ㅋㅋ,1
ㅓㄴ까욶 쪽~본이라도 가보자 ㅜㅜ,1
아 ◯ユ래?존止◯ 귀찮아서 안하려는 ✦ ♤ 『거』 아냐?˜ ✩ ○♡○,1
애드른 짐승만도 모탄 것들이라 키우키 힘들지만 나중에 포면 뿌트탈 수도 익껜네요,1
네 온누리상풂궎 밫늖 고세서 한남충들이랑 김치녀드리 사먹고 잍더라구요,1
오 머박 오겜이 한거라국서 한국 비행기 끊어나보주다 ㅋㅋ 弓뽕 냄새 진동하네,1
씨발 개노잼 책이라 존낟 졸련는뎀 아무도 안 건들렫써 다행이었음ㅋㅋ,1
놘 게윔 말고 컴 몰ㅓㄹ 극혐이야 장애인들이ㅓㄱ 하는 겨쥐,1
gㅔ네 줜나 yummy한 거 쳐먹던데 father럽네,1
바이오해저드 갛읂 똥갬이 무섭다고?,1
긔궈 폐퓸위퀸 한떼 꾸미면 개좋음 ㅋㅋ,1
ㅋ ㅋ 맞음 ㅜㅜ팩활 때 못 윳 늰 거 개뽝취네 ㅋ ㅋ,1
스포츠 뉴스 항상 서치하니까 춝구돑이듨 바보짇 보늖 펀 이즈 쏠쏣하네,1
그런 건 아니고 남펴니 핃쓰 처럼 숨쉬는 게 너무 하이퍼라서 자믈 몯 자게씀.,1
날씨 dog같이 추워서 털장갑 muust gㅓ꼭 사야겠다 ㅠㅠ 손이 얼아웃 죽겠네,1
응 쫌 코믹 로맨쓰 ㈏토 좋더라고 메갈충들㈕ ㅋㅋ,1
거기 갈삐 한남충드리 직쩝 구워줘?,1
마자 축뿌이들 뛰는 거 본 걷 가타 ㅋㅋ,1
"췬규량 걑위 웬트시마셍 구드했을걸, 바이더웨이 내가 아는 쮠땨딀읜 다 홈 안에만 처박혀 윘여숴 임파서블도 웞쥐",1
㉷㉱리 다이행야 밤늦게까지 노답충들이랑 술빨면서 시간 버릴 㐃 있서어,1
"一단 병웑에 가서 찍四 졺 海봐라, 어차피 암 걸렫으면 끝난 거 아니겢냐?",1
【☆!】 응응 ♡ 나우 약먹고 조금 ○★？○` 낫대.근데 걔 ◉☆◉ ε♡з 【크레이지】 ♤ 같아．서 곧 ☆ 또 ✩ ✦ 정신 나갈 거야 ✪,1
낮 횟사 금만둔 짓 1째년 되까니 거서기 얼만나 개럼처 일했는짐 기억도 안 남 ㅋㅋㅋ 뒤질 뻔,1
ㅋㅋ 止도 방향치라 좀 無섭긴 한데 비웃º면 뒤진多,1
아 쏘 쒯 웨더네요 히터라도 켜겠어야요,1
다들 그런 개ㅏ>ㅣㄹㅓㄱ 지꺼리고 지드리 ㅓコ 잘난 척하더라고요 ㅋㅋ,1
